{
  "$ref": "#/definitions/certificacoes",
  "definitions": {
    "certificacoes": {
      "type": "object",
      "properties": {
        "tipo": {
          "type": "string"
        },
        "titulo": {
          "type": "string"
        },
        "instituicao": {
          "type": "string"
        },
        "ano": {
          "type": "string"
        },
        "descricao": {
          "type": "string"
        },
        "$schema": {
          "type": "string"
        }
      },
      "required": [
        "tipo",
        "titulo",
        "instituicao",
        "ano"
      ],
      "additionalProperties": false
    }
  },
  "$schema": "http://json-schema.org/draft-07/schema#"
}