{
  "tipo": "certificacao",
  "titulo": "LPIC-2 - Linux Engineer",
  "instituicao": "lpi.org",
  "ano": "2022 - 2023",
  "descricao": "O LPIC-2 é a segunda certificação no programa de certificação profissional de múltiplos níveis do Linux do Linux Professional Institute (LPI). Valida a capacidade de administrar redes mistas de pequeno a médio porte. Composta pelos exames 201-450 e 202-450."
}
