{
  "tipo": "certificacao",
  "titulo": "LPIC-1 - Linux Administrator",
  "instituicao": "lpi.org",
  "ano": "2022",
  "descricao": "O LPIC-1 é a primeira certificação no programa de certificação profissional em vários níveis do Linux do Linux Professional Institute (LPI). Composta pelos exames 101-500 e 102-500."
}
