{
  "tipo": "certificacao",
  "titulo": "Azure AZ-900 Microsoft Azure Fundamentals",
  "instituicao": "microsoft.com",
  "ano": "2023",
  "descricao": "O exame de Fundamentos do Azure é uma oportunidade de comprovar o conhecimento dos conceitos de nuvem, serviços do Azure, cargas de trabalho do Azure, segurança e privacidade no Azure, bem como preços e suporte do Azure."
}
